{
  "schema_version": "1.0.0",
  "record_type": "synthesis_group",
  "id": "senolytics-dq-bone-ctx-20wk-synthesis-compatibility-2026-06-21",
  "name": "D+Q bone RCT 20-week CTx synthesis compatibility",
  "assessed_at": "2026-06-21T21:45:00Z",
  "question": "Can the 20-week CTx result from the D+Q postmenopausal bone RCT be pooled for a meta-analysis estimate?",
  "track_ids": [
    "senolytics"
  ],
  "hallmark_ids": [
    "cellular_senescence",
    "stem_cell_exhaustion"
  ],
  "intervention_ids": [
    "dasatinib-quercetin"
  ],
  "compatibility_basis": {
    "population": "Postmenopausal women in the D+Q and untreated-control arms of one phase 2 randomized trial.",
    "intervention": "Intermittent dasatinib plus quercetin.",
    "comparator": "Untreated control.",
    "endpoint_family": "Serum CTx percent change.",
    "time_horizon": "Baseline to 20 weeks.",
    "effect_metric": "Between-group CTx percent-change effect with uncertainty.",
    "variance_model": "No pooling model selected because only one result is available and the effect record is p-value-only."
  },
  "outcome_ids": [
    "dq-bone-ctx-20wk"
  ],
  "result_ids": [
    "dq-bone-ctx-20wk-null"
  ],
  "compatibility_status": "needs_extraction",
  "pooling_decision": "pooling_blocked",
  "pooling_rationale": "Pooling is blocked by result count and extraction completeness. This endpoint-specific group has one CTx result from one trial, while the pooling requirement is at least two compatible results. The registry record contains arm medians, full ranges, and a Wilcoxon p-value, but no extractable between-group effect value or CI, standard error, or variance.",
  "non_pooling_reason": "Do not pool this primary CTx endpoint until at least one additional compatible CTx result is available and every included result has an effect value, uncertainty estimate, comparison, sample size, and required group-value fields.",
  "pooling_requirements": {
    "minimum_result_count": 2,
    "required_result_maturity_statuses": [
      "registry_extracted",
      "full_text_extracted",
      "agent_reviewed",
      "supervisor_agent_reviewed",
      "accepted"
    ],
    "required_effect_fields": [
      "effect.value",
      "effect.uncertainty",
      "analysis.comparison",
      "sample_size",
      "group_values[].sample_size",
      "group_values[].statistic",
      "group_values[].dispersion"
    ],
    "missing_effect_fields_by_result": [
      {
        "result_id": "dq-bone-ctx-20wk-null",
        "missing_fields": [
          "effect.value",
          "effect.uncertainty"
        ],
        "impact": "blocks_pooling",
        "note": "The result is a p-value-only overall CTx comparison with group medians and full ranges; full range is not a variance estimate, and only one endpoint result is available."
      }
    ]
  },
  "agent_supervision": {
    "assessing_agent": "codex-synthesis-agent",
    "supervisor_agent": "pending-supervisor-review",
    "audit_status": "passed",
    "self_healing_actions": [
      "Keep this endpoint group in pooling_blocked state until effect uncertainty and at least one additional compatible CTx result are available.",
      "Route p-value-only CTx extraction to extraction_refresh if full text or supplements provide a between-group estimate with uncertainty."
    ]
  },
  "maturity_status": "agent_reviewed",
  "provenance": [
    {
      "source_id": "nct-04313634",
      "source_snapshot_id": "snapshot-nct-04313634-clinicaltrials-v2-2026-06-21",
      "locator_type": "clinicaltrials_module",
      "locator": "resultsSection.outcomeMeasuresModule.outcomeMeasures[0]",
      "status": "registry_extracted",
      "note": "Posted primary CTx outcome group values and D+Q versus untreated-control p-value."
    },
    {
      "source_id": "pmid-38956196",
      "source_snapshot_id": "snapshot-pmid-38956196-pubmed-efetch-2026-06-21",
      "locator_type": "abstract",
      "locator": "PubMed abstract primary endpoint sentence",
      "status": "abstract_extracted",
      "note": "Abstract confirms no significant overall CTx difference between groups."
    }
  ],
  "tags": [
    "senolytics",
    "dasatinib-quercetin",
    "bone",
    "ctx",
    "primary-outcome",
    "pooling-blocked"
  ]
}
